{
  "id": "agriturismo-prova-brda-2",
  "nome": "Agriturismo Prova Brda",
  "lingue": [
    "it",
    "en"
  ],
  "sezioni": [
    {
      "nome": {
        "it": "Antipasti",
        "en": "Starters"
      },
      "voci": [
        {
          "nome": {
            "it": "Tagliere di salumi del Collio",
            "en": "Collio cured meat board"
          },
          "prezzo": "14,00"
        },
        {
          "nome": {
            "it": "Frico con polenta",
            "en": "Frico with polenta"
          },
          "prezzo": "12,00"
        },
        {
          "nome": {
            "it": "Sardoni impanati",
            "en": "Breaded sardines"
          },
          "prezzo": "9,00"
        }
      ]
    },
    {
      "nome": {
        "it": "Primi",
        "en": "First courses"
      },
      "voci": [
        {
          "nome": {
            "it": "Gnocchi di susine",
            "en": "Plum gnocchi"
          },
          "prezzo": "10,00",
          "allergeni": [
            "1",
            "3"
          ]
        },
        {
          "nome": {
            "it": "Blecs al ragù di cortile",
            "en": "Blecs with farm ragù"
          },
          "prezzo": "12,00"
        }
      ]
    },
    {
      "nome": {
        "it": "Secondi",
        "en": "Main courses"
      },
      "voci": [
        {
          "nome": {
            "it": "Cevapcici con ajvar",
            "en": "Cevapcici with ajvar"
          },
          "prezzo": "13,50"
        },
        {
          "nome": {
            "it": "Stinco di maiale al forno",
            "en": "Roast pork knuckle"
          },
          "prezzo": "16,00"
        },
        {
          "nome": {
            "it": "Trota del Natisone alla griglia",
            "en": "Grilled Natisone trout"
          },
          "prezzo": "15,00"
        }
      ]
    },
    {
      "nome": {
        "it": "Dolci",
        "en": "Desserts"
      },
      "voci": [
        {
          "nome": {
            "it": "Gubana con grappa",
            "en": "Gubana with grappa"
          },
          "prezzo": "6,00"
        },
        {
          "nome": {
            "it": "Strudel di mele",
            "en": "Apple strudel"
          },
          "prezzo": "5,50"
        }
      ]
    },
    {
      "nome": {
        "it": "Vini al calice",
        "en": "Wine by the glass"
      },
      "voci": [
        {
          "nome": {
            "it": "Ribolla Gialla",
            "en": "Ribolla Gialla"
          },
          "prezzo": "5,00"
        },
        {
          "nome": {
            "it": "Terrano (calice)",
            "en": "Terrano (glass)"
          },
          "prezzo": "5,00"
        },
        {
          "nome": {
            "it": "Terrano (bottiglia)",
            "en": "Terrano (bottle)"
          },
          "prezzo": "22,00"
        }
      ]
    }
  ],
  "coperto": "2,50"
}
