{
  "id": "agriturismo-prova-brda",
  "nome": "Agriturismo Prova Brda",
  "lingue": [
    "it",
    "en"
  ],
  "sezioni": [
    {
      "nome": {
        "it": "Antipasti",
        "en": "Starters"
      },
      "voci": [
        {
          "nome": {
            "it": "Frico con polenta",
            "en": "Frico with polenta"
          },
          "prezzo": "9,00"
        }
      ]
    },
    {
      "nome": {
        "it": "PRIMI",
        "en": "First courses"
      },
      "voci": [
        {
          "nome": {
            "it": "Gnocchi di susine",
            "en": "Plum gnocchi"
          },
          "prezzo": "11,00"
        },
        {
          "nome": {
            "it": "Pizza 4 formaggi",
            "en": "4 cheese pizza"
          },
          "prezzo": "10,00"
        }
      ]
    },
    {
      "nome": {
        "it": "Dolci",
        "en": "Desserts"
      },
      "voci": [
        {
          "nome": {
            "it": "Strudel di mele",
            "en": "Apple strudel"
          },
          "prezzo": "5,50"
        }
      ]
    }
  ]
}
