{
  "id": "riccardo-sei-il-migliore",
  "nome": "Riccardo sei il migliore",
  "lingue": [
    "it",
    "en"
  ],
  "sezioni": [
    {
      "nome": {
        "it": "Antipasti di Carne e Pesce",
        "en": "Meat and fish starters"
      },
      "voci": [
        {
          "nome": {
            "it": "Uovo pochè, fonduta leggera al montasio e speck croccante su insalatina (3,7,9,12)",
            "en": "Poached egg, light Montasio fondue and crispy speck on salad (3,7,9,12)"
          },
          "prezzo": "11,00"
        },
        {
          "nome": {
            "it": "Fiori di zucca ripieni di alici e montasio , salsa al montasio , noci croccanti e prosciutto crudo * (1,3,4,7,8)",
            "en": "Zucchini flowers filled with anchovies and Montasio, Montasio sauce, crunchy walnuts and raw ham * (1,3,4,7,8)"
          },
          "prezzo": "13,00"
        },
        {
          "nome": {
            "it": "Prosciutto crudo e burrata (7)",
            "en": "Raw ham and burrata (7)"
          },
          "prezzo": "15,00"
        },
        {
          "nome": {
            "it": "Baccalà mantecato (1, 4)",
            "en": "Mashed cod (1, 4)"
          },
          "prezzo": "13,00"
        },
        {
          "nome": {
            "it": "Sarde alla veneziana(4)",
            "en": "Venetian-style sardines(4)"
          },
          "prezzo": "12,00"
        }
      ]
    },
    {
      "nome": {
        "it": "Primi di Carne e Pesce",
        "en": "Meat and fish first courses"
      },
      "voci": [
        {
          "nome": {
            "it": "Tagliolino con ragù di cortile (manzo,maiale,anatra)",
            "en": "Tagliolino with farmyard meat ragù (beef, pork, duck)"
          },
          "prezzo": "13,00"
        },
        {
          "nome": {
            "it": "Risotto ai funghi porcini",
            "en": "Porcini mushroom risotto"
          },
          "prezzo": "15,00"
        },
        {
          "nome": {
            "it": "Tagliolino al San Daniele",
            "en": "Tagliolino with San Daniele"
          },
          "prezzo": "15,00"
        },
        {
          "nome": {
            "it": "Tagliatelle di pasta fresca al nero di seppia con piselli , pomodori e gamberi saltati",
            "en": "Fresh pasta tagliatelle with cuttlefish ink, peas, tomatoes and sautéed prawns"
          },
          "prezzo": "14,00"
        },
        {
          "nome": {
            "it": "Spaghetti alle vongole con bisque di crostacei",
            "en": "Spaghetti with clams and crustacean bisque"
          },
          "prezzo": "15,00"
        },
        {
          "nome": {
            "it": "Calamarata con pesto di pistacchio e tartare di gamberi",
            "en": "Calamarata with pistachio pesto and prawn tartare"
          },
          "prezzo": "15,00"
        }
      ]
    },
    {
      "nome": {
        "it": "Secondi di Carne e Pesce",
        "en": "Meat and fish main courses"
      },
      "voci": [
        {
          "nome": {
            "it": "Frico di patate con salame e cipolla (7,9,12)",
            "en": "Frico of potatoes with salami and onion (7,9,12)"
          },
          "prezzo": "14,00"
        },
        {
          "nome": {
            "it": "Costine di manzo con salsa barbecue (9,10,12)",
            "en": "Beef ribs with barbecue sauce (9,10,12)"
          },
          "prezzo": "15,00"
        },
        {
          "nome": {
            "it": "Guancia di maiale in C.b.t. su purè di patate (7,9,12)",
            "en": "Pork cheek in C.b.t. on mashed potatoes (7,9,12)"
          },
          "prezzo": "16,00"
        },
        {
          "nome": {
            "it": "Filetto di manzo con patate al forno",
            "en": "Beef fillet with roasted potatoes"
          },
          "prezzo": "25,00"
        },
        {
          "nome": {
            "it": "Calamari fritti con verdure pastellate *(1,3,7,14)",
            "en": "Fried squid with pastel-coloured vegetables * (1,3,7,14)"
          },
          "prezzo": "15,00"
        },
        {
          "nome": {
            "it": "Tonno scottato in semi di papavero e di sesamo su crema di piselli (4,7,11)",
            "en": "Seared tuna in poppy and sesame seeds on pea cream (4,7,11)"
          },
          "prezzo": "20,00"
        },
        {
          "nome": {
            "it": "Filetto di orata alla mediterranea (4,7,12)",
            "en": "Mediterranean sea bream fillet (4,7,12)"
          },
          "prezzo": "16,00"
        }
      ]
    },
    {
      "nome": {
        "it": "Contorni",
        "en": "Sides"
      },
      "voci": [
        {
          "nome": {
            "it": "Insalata mista",
            "en": "Mixed salad"
          },
          "prezzo": "5,00"
        },
        {
          "nome": {
            "it": "Patate al forno (1)",
            "en": "Baked potatoes (1)"
          },
          "prezzo": "5,00"
        },
        {
          "nome": {
            "it": "Piselli alla contadina con pancetta e cipolla* (1,7,12)",
            "en": "Peas with pancetta and onion (1,7,12)"
          },
          "prezzo": "5,00"
        },
        {
          "nome": {
            "it": "Spinaci saltati al burro*(7)",
            "en": "Buttered spinach (7)"
          },
          "prezzo": "5,00"
        }
      ]
    }
  ],
  "coperto": "3,00"
}
