{"id":"pub-underground","nome":"Pub Underground","sottotitolo":{"it":"Burger · birre · takeaway","en":"Burgers · beers · takeaway"},"indirizzo":"Gorizia · Via Lunga","orari":{"it":"Aperto oggi · servizio in sala, banco e asporto","en":"Open today · room, counter and takeaway service"},"avviso":{"it":"Oggi: Underground burger e proposta Beer & bite dalle 18:00.","en":"Today: Underground burger and Beer & bite from 6 pm."},"note":{"it":"Per allergie e intolleranze chiedi sempre conferma al personale.","en":"For allergies and intolerances, always ask our staff for confirmation."},"lingue":["it","en"],"sezioni":[{"nome":{"it":"Condivisione","en":"To share"},"voci":[{"nome":{"it":"Chicken wings BBQ","en":"BBQ chicken wings"},"descrizione":{"it":"Alette croccanti, salsa BBQ affumicata e sedano.","en":"Crispy wings, smoky BBQ sauce and celery."},"prezzo":"9","allergeni":["9"]},{"nome":{"it":"Loaded fries","en":"Loaded fries"},"descrizione":{"it":"Patate, cheddar, bacon croccante e salsa Underground.","en":"Fries, cheddar, crispy bacon and Underground sauce."},"prezzo":"8","allergeni":["7"]},{"nome":{"it":"Nachos & guacamole","en":"Nachos & guacamole"},"descrizione":{"it":"Mais croccante, guacamole e pico de gallo.","en":"Crispy corn, guacamole and pico de gallo."},"prezzo":"8"}]},{"nome":{"it":"Burger e panini","en":"Burgers and sandwiches"},"voci":[{"nome":{"it":"Underground burger","en":"Underground burger"},"descrizione":{"it":"Manzo, cheddar, cipolla croccante e salsa della casa.","en":"Beef, cheddar, crispy onion and house sauce."},"prezzo":"15","allergeni":["1","3","7"]},{"nome":{"it":"Pulled pork sandwich","en":"Pulled pork sandwich"},"descrizione":{"it":"Maiale sfilacciato, coleslaw e salsa BBQ.","en":"Pulled pork, coleslaw and BBQ sauce."},"prezzo":"14","allergeni":["1","3"]},{"nome":{"it":"Fish & chips","en":"Fish & chips"},"descrizione":{"it":"Frittura croccante, patate e salsa tartara.","en":"Crispy fish, fries and tartar sauce."},"prezzo":"14","allergeni":["1","3","4","7"]}]},{"nome":{"it":"Bevande","en":"Drinks"},"voci":[{"nome":{"it":"IPA artigianale · 40 cl","en":"Craft IPA · 40 cl"},"descrizione":{"it":"Amara, agrumata e locale.","en":"Bitter, citrusy and local."},"prezzo":"7","allergeni":["1"]},{"nome":{"it":"Lager alla spina · 40 cl","en":"Draft lager · 40 cl"},"prezzo":"6","allergeni":["1"]},{"nome":{"it":"Ginger beer · 33 cl","en":"Ginger beer · 33 cl"},"prezzo":"4"}]}]}