{"id":"caffe-bon-bon","nome":"Caffè Bon Bon","sottotitolo":{"it":"Caffè · brunch · aperitivo","en":"Coffee · brunch · aperitivo"},"indirizzo":"Gorizia · Via Oberdan","orari":{"it":"Aperto oggi · proposte variabili durante la giornata","en":"Open today · changing offers throughout the day"},"avviso":{"it":"Oggi: All You Can Spritz e Bon Bon brunch nel weekend.","en":"Today: All You Can Spritz and Bon Bon brunch on weekends."},"note":{"it":"Per allergie e intolleranze chiedi sempre conferma al personale.","en":"For allergies and intolerances, always ask our staff for confirmation."},"lingue":["it","en"],"sezioni":[{"nome":{"it":"Cicchetti e snack","en":"Cicchetti and snacks"},"voci":[{"nome":{"it":"Cicchetti misti Bon Bon","en":"Bon Bon mixed cicchetti"},"descrizione":{"it":"Tre assaggi salati scelti dalla vetrina del giorno.","en":"Three savoury bites selected from today's display."},"prezzo":"8","allergeni":["1","7"]},{"nome":{"it":"Toast gourmet","en":"Gourmet toast"},"descrizione":{"it":"Pane ai cereali, prosciutto cotto e crema al formaggio.","en":"Multigrain bread, ham and cheese cream."},"prezzo":"7","allergeni":["1","7"]},{"nome":{"it":"Hummus & crostini","en":"Hummus & crostini"},"descrizione":{"it":"Hummus di ceci, verdure marinate e crostini.","en":"Chickpea hummus, marinated vegetables and crostini."},"prezzo":"7","allergeni":["1"]}]},{"nome":{"it":"Brunch","en":"Brunch"},"voci":[{"nome":{"it":"Brunch board","en":"Brunch board"},"descrizione":{"it":"Uova, salmone, pane tostato, yogurt e frutta.","en":"Eggs, salmon, toast, yogurt and fruit."},"prezzo":"16","allergeni":["1","3","4","7"]},{"nome":{"it":"Club sandwich","en":"Club sandwich"},"descrizione":{"it":"Pollo, bacon, lattuga e patatine croccanti.","en":"Chicken, bacon, lettuce and crisp fries."},"prezzo":"12","allergeni":["1","3"]},{"nome":{"it":"Avocado toast","en":"Avocado toast"},"descrizione":{"it":"Pane tostato, avocado, uovo pochè e semi.","en":"Toast, avocado, poached egg and seeds."},"prezzo":"10","allergeni":["1","3"]}]},{"nome":{"it":"Dolci e caffè","en":"Desserts and coffee"},"voci":[{"nome":{"it":"Pancake della casa","en":"House pancakes"},"descrizione":{"it":"Frutti rossi, sciroppo d’acero e crema allo yogurt.","en":"Berries, maple syrup and yogurt cream."},"prezzo":"8","allergeni":["1","3","7"]},{"nome":{"it":"Cheesecake al pistacchio","en":"Pistachio cheesecake"},"prezzo":"7","allergeni":["1","7","8"]},{"nome":{"it":"Espresso specialty · doppio","en":"Specialty espresso · double"},"prezzo":"3"}]},{"nome":{"it":"Aperitivo","en":"Aperitivo"},"voci":[{"nome":{"it":"All You Can Spritz","en":"All You Can Spritz"},"descrizione":{"it":"Spritz selezionati e stuzzichini · fascia aperitivo.","en":"Selected spritzes and small bites · aperitivo time."},"prezzo":"12"}]}]}