{"id":"buffet-alla-valletta","nome":"Buffet alla Valletta","sottotitolo":{"it":"Pescato del giorno · cicchetti · cucina di confine","en":"Catch of the day · cicchetti · borderland cooking"},"indirizzo":"Gorizia · centro storico","orari":{"it":"Aperto oggi · disponibilità fino a esaurimento","en":"Open today · available until sold out"},"avviso":{"it":"Oggi: sarde in saor, baccalà mantecato e cicchetti della Valletta.","en":"Today: saor sardines, creamed cod and Valletta cicchetti."},"note":{"it":"Per allergie e intolleranze chiedi sempre conferma al personale.","en":"For allergies and intolerances, always ask our staff for confirmation."},"lingue":["it","en"],"sezioni":[{"nome":{"it":"Cicchetti e antipasti","en":"Cicchetti and starters"},"voci":[{"nome":{"it":"Sarde in saor","en":"House-style saor sardines"},"descrizione":{"it":"Cipolla in agrodolce, uvetta e pinoli su polenta morbida.","en":"Sweet-and-sour onion, raisins and pine nuts on soft polenta."},"prezzo":"9","allergeni":["4","8"]},{"nome":{"it":"Baccalà mantecato","en":"Creamed cod"},"descrizione":{"it":"Crema di baccalà, pane tostato e prezzemolo.","en":"Creamed cod, toasted bread and parsley."},"prezzo":"11","allergeni":["1","4"]},{"nome":{"it":"Cicchetto di alici e burrata","en":"Anchovy and burrata cicchetto"},"descrizione":{"it":"Alici marinate, burrata e pane rustico.","en":"Marinated anchovies, burrata and rustic bread."},"prezzo":"8","allergeni":["1","4","7"]}]},{"nome":{"it":"Primi","en":"First courses"},"voci":[{"nome":{"it":"Spaghetti alle vongole","en":"Spaghetti with clams"},"descrizione":{"it":"Vongole veraci, prezzemolo e olio al limone.","en":"Clams, parsley and lemon oil."},"prezzo":"16","allergeni":["1","14"]},{"nome":{"it":"Risotto al pescato del giorno","en":"Catch-of-the-day risotto"},"descrizione":{"it":"Mantecato al fumetto di pesce e verdure croccanti.","en":"Fish-stock risotto with crisp vegetables."},"prezzo":"17","allergeni":["4","7"]}]},{"nome":{"it":"Secondi","en":"Main courses"},"voci":[{"nome":{"it":"Fritto misto della Valletta","en":"Valletta mixed fry"},"descrizione":{"it":"Calamari, gamberi e verdure in pastella leggera.","en":"Calamari, prawns and vegetables in a light batter."},"prezzo":"20","allergeni":["1","2","4"]},{"nome":{"it":"Filetto di branzino alla piastra","en":"Grilled sea bass"},"descrizione":{"it":"Patate al rosmarino e insalata di stagione.","en":"Rosemary potatoes and seasonal salad."},"prezzo":"19","allergeni":["4"]}]},{"nome":{"it":"Bevande","en":"Drinks"},"voci":[{"nome":{"it":"Malvasia del Collio · calice","en":"Collio Malvasia · glass"},"prezzo":"6"},{"nome":{"it":"Prosecco · calice","en":"Prosecco · glass"},"prezzo":"5"}]}]}