{
  "id": "pizzeria-da-richard",
  "nome": "pizzeria da Richard",
  "lingue": [
    "it",
    "en"
  ],
  "sezioni": [
    {
      "nome": {
        "it": "Antipasti",
        "en": "Starters"
      },
      "voci": [
        {
          "nome": {
            "it": "Richard fritto",
            "en": "Richard fried"
          },
          "prezzo": "10,00"
        },
        {
          "nome": {
            "it": "Richard bollito",
            "en": "Richard boiled"
          },
          "prezzo": "15,00"
        },
        {
          "nome": {
            "it": "Richard nudo",
            "en": "Richard naked"
          },
          "prezzo": "50,00"
        }
      ]
    },
    {
      "nome": {
        "it": "Primi",
        "en": "First courses"
      },
      "voci": [
        {
          "nome": {
            "it": "Richard sbronzo",
            "en": "Richard drunk"
          },
          "prezzo": "20,00"
        },
        {
          "nome": {
            "it": "Richard sotto acido",
            "en": "Richard under acid"
          },
          "prezzo": "5,00"
        },
        {
          "nome": {
            "it": "Richard imbalonado",
            "en": "Richard ballooned"
          },
          "prezzo": "25,00"
        }
      ]
    },
    {
      "nome": {
        "it": "Secondi",
        "en": "Main courses"
      },
      "voci": [
        {
          "nome": {
            "it": "Richard ustionato",
            "en": "Richard burned"
          },
          "prezzo": "30,00"
        },
        {
          "nome": {
            "it": "Richard scottato",
            "en": "Richard scalded"
          },
          "prezzo": "45,00"
        }
      ]
    },
    {
      "nome": {
        "it": "Dolci",
        "en": "Desserts"
      },
      "voci": [
        {
          "nome": {
            "it": "Richard in glassa",
            "en": "Richard glazed"
          },
          "prezzo": "10,00"
        },
        {
          "nome": {
            "it": "Richard nature",
            "en": "Richard natural"
          },
          "prezzo": "25,00"
        }
      ]
    }
  ],
  "coperto": "20,00"
}
